{
  "schemaVersion": 1,
  "areaSizesKm": {
    "place": [
      16,
      16
    ],
    "route": [
      25,
      10
    ],
    "city": [
      8,
      8
    ]
  },
  "zoom": {
    "place": [
      12,
      16
    ],
    "route": [
      12,
      16
    ],
    "city": [
      12,
      17
    ]
  },
  "areas": [
    {
      "id": "cinque-terre",
      "kind": "place",
      "name": {
        "en": "Cinque Terre"
      },
      "countryCodes": [
        "IT"
      ],
      "continent": "europe",
      "center": [
        9.71,
        44.12
      ],
      "tags": [
        "coast"
      ],
      "regionHints": [
        "nord-ovest"
      ]
    },
    {
      "id": "plitvice-lakes",
      "kind": "place",
      "name": {
        "en": "Plitvice Lakes"
      },
      "countryCodes": [
        "HR"
      ],
      "continent": "europe",
      "center": [
        15.62,
        44.88
      ],
      "tags": [
        "lakes",
        "forest"
      ]
    },
    {
      "id": "teide",
      "kind": "place",
      "name": {
        "en": "Teide, Tenerife"
      },
      "countryCodes": [
        "ES"
      ],
      "continent": "europe",
      "center": [
        -16.64,
        28.27
      ],
      "tags": [
        "volcano"
      ],
      "regionHints": [
        "canary",
        "canarias",
        "canaries"
      ]
    },
    {
      "id": "saxon-switzerland",
      "kind": "place",
      "name": {
        "en": "Saxon Switzerland"
      },
      "countryCodes": [
        "DE"
      ],
      "continent": "europe",
      "center": [
        14.07,
        50.92
      ],
      "tags": [
        "rocks",
        "forest"
      ],
      "regionHints": [
        "sachsen",
        "deu-north",
        "deu-south"
      ]
    },
    {
      "id": "dolomites-tre-cime",
      "kind": "place",
      "name": {
        "en": "Dolomites – Tre Cime"
      },
      "countryCodes": [
        "IT"
      ],
      "continent": "europe",
      "center": [
        12.3,
        46.62
      ],
      "tags": [
        "mountains"
      ],
      "regionHints": [
        "nord-est",
        "alpes"
      ],
      "featured": true
    },
    {
      "id": "chamonix-mont-blanc",
      "kind": "place",
      "name": {
        "en": "Chamonix–Mont Blanc"
      },
      "countryCodes": [
        "FR"
      ],
      "continent": "europe",
      "center": [
        6.87,
        45.92
      ],
      "tags": [
        "mountains",
        "glaciers"
      ],
      "regionHints": [
        "rhone-alpes",
        "southeast",
        "alpes"
      ],
      "featured": true
    },
    {
      "id": "zermatt",
      "kind": "place",
      "name": {
        "en": "Zermatt"
      },
      "countryCodes": [
        "CH"
      ],
      "continent": "europe",
      "center": [
        7.75,
        46.0
      ],
      "tags": [
        "mountains",
        "glaciers"
      ],
      "featured": true
    },
    {
      "id": "jungfrau-lauterbrunnen",
      "kind": "place",
      "name": {
        "en": "Jungfrau – Lauterbrunnen"
      },
      "countryCodes": [
        "CH"
      ],
      "continent": "europe",
      "center": [
        7.95,
        46.6
      ],
      "tags": [
        "mountains"
      ]
    },
    {
      "id": "hallstatt-dachstein",
      "kind": "place",
      "name": {
        "en": "Hallstatt–Dachstein"
      },
      "countryCodes": [
        "AT"
      ],
      "continent": "europe",
      "center": [
        13.66,
        47.53
      ],
      "tags": [
        "lakes",
        "mountains"
      ]
    },
    {
      "id": "berchtesgaden-koenigssee",
      "kind": "place",
      "name": {
        "en": "Berchtesgaden–Königssee"
      },
      "countryCodes": [
        "DE"
      ],
      "continent": "europe",
      "center": [
        12.98,
        47.55
      ],
      "tags": [
        "lakes",
        "mountains"
      ],
      "regionHints": [
        "bayern",
        "deu-south",
        "alpes"
      ]
    },
    {
      "id": "triglav-bohinj",
      "kind": "place",
      "name": {
        "en": "Triglav–Bohinj"
      },
      "countryCodes": [
        "SI"
      ],
      "continent": "europe",
      "center": [
        13.85,
        46.3
      ],
      "tags": [
        "mountains",
        "lakes"
      ]
    },
    {
      "id": "high-tatras",
      "kind": "place",
      "name": {
        "en": "High Tatras"
      },
      "countryCodes": [
        "SK",
        "PL"
      ],
      "continent": "europe",
      "center": [
        20.05,
        49.2
      ],
      "tags": [
        "mountains"
      ]
    },
    {
      "id": "krkonose",
      "kind": "place",
      "name": {
        "en": "Krkonoše"
      },
      "countryCodes": [
        "CZ",
        "PL"
      ],
      "continent": "europe",
      "center": [
        15.74,
        50.74
      ],
      "tags": [
        "mountains",
        "forest"
      ]
    },
    {
      "id": "lake-district",
      "kind": "place",
      "name": {
        "en": "Lake District"
      },
      "countryCodes": [
        "GB"
      ],
      "continent": "europe",
      "center": [
        -3.1,
        54.45
      ],
      "tags": [
        "lakes",
        "mountains"
      ],
      "regionHints": [
        "england",
        "grandebretagne"
      ]
    },
    {
      "id": "lofoten-reine",
      "kind": "place",
      "name": {
        "en": "Lofoten – Reine"
      },
      "countryCodes": [
        "NO"
      ],
      "continent": "europe",
      "center": [
        13.09,
        67.93
      ],
      "tags": [
        "coast",
        "mountains"
      ],
      "featured": true
    },
    {
      "id": "preikestolen",
      "kind": "place",
      "name": {
        "en": "Preikestolen"
      },
      "countryCodes": [
        "NO"
      ],
      "continent": "europe",
      "center": [
        6.19,
        58.99
      ],
      "tags": [
        "coast",
        "rocks"
      ]
    },
    {
      "id": "picos-de-europa",
      "kind": "place",
      "name": {
        "en": "Picos de Europa"
      },
      "countryCodes": [
        "ES"
      ],
      "continent": "europe",
      "center": [
        -4.85,
        43.2
      ],
      "tags": [
        "mountains"
      ],
      "regionHints": [
        "cantabria",
        "asturias"
      ]
    },
    {
      "id": "mallorca-tramuntana",
      "kind": "place",
      "name": {
        "en": "Mallorca – Serra de Tramuntana"
      },
      "countryCodes": [
        "ES"
      ],
      "continent": "europe",
      "center": [
        2.8,
        39.8
      ],
      "tags": [
        "coast",
        "mountains"
      ],
      "regionHints": [
        "baleares",
        "balears"
      ]
    },
    {
      "id": "madeira-pico-ruivo",
      "kind": "place",
      "name": {
        "en": "Madeira – Pico Ruivo"
      },
      "countryCodes": [
        "PT"
      ],
      "continent": "europe",
      "center": [
        -16.94,
        32.76
      ],
      "tags": [
        "island",
        "mountains"
      ]
    },
    {
      "id": "landmannalaugar",
      "kind": "place",
      "name": {
        "en": "Landmannalaugar"
      },
      "countryCodes": [
        "IS"
      ],
      "continent": "europe",
      "center": [
        -19.06,
        63.99
      ],
      "tags": [
        "highlands"
      ]
    },
    {
      "id": "mount-olympus",
      "kind": "place",
      "name": {
        "en": "Mount Olympus"
      },
      "countryCodes": [
        "GR"
      ],
      "continent": "europe",
      "center": [
        22.36,
        40.09
      ],
      "tags": [
        "mountains",
        "non-latin-labels"
      ],
      "featured": true
    },
    {
      "id": "curonian-spit-nida",
      "kind": "place",
      "name": {
        "en": "Curonian Spit – Nida"
      },
      "countryCodes": [
        "LT"
      ],
      "continent": "europe",
      "center": [
        21.0,
        55.3
      ],
      "tags": [
        "dunes",
        "coast"
      ]
    },
    {
      "id": "gauja-sigulda",
      "kind": "place",
      "name": {
        "en": "Gauja – Sigulda"
      },
      "countryCodes": [
        "LV"
      ],
      "continent": "europe",
      "center": [
        24.86,
        57.15
      ],
      "tags": [
        "river",
        "forest"
      ]
    },
    {
      "id": "zugspitze-garmisch",
      "kind": "place",
      "name": {
        "en": "Zugspitze – Garmisch-Partenkirchen"
      },
      "countryCodes": [
        "DE"
      ],
      "continent": "europe",
      "center": [
        11.0,
        47.42
      ],
      "tags": [
        "mountains"
      ],
      "regionHints": [
        "bayern",
        "deu-south",
        "alpes"
      ]
    },
    {
      "id": "allgaeu-oberstdorf",
      "kind": "place",
      "name": {
        "en": "Allgäu – Oberstdorf"
      },
      "countryCodes": [
        "DE"
      ],
      "continent": "europe",
      "center": [
        10.28,
        47.38
      ],
      "tags": [
        "mountains"
      ],
      "regionHints": [
        "bayern",
        "deu-south",
        "alpes"
      ]
    },
    {
      "id": "harz-brocken",
      "kind": "place",
      "name": {
        "en": "Harz – Brocken"
      },
      "countryCodes": [
        "DE"
      ],
      "continent": "europe",
      "center": [
        10.62,
        51.8
      ],
      "tags": [
        "forest"
      ],
      "regionHints": [
        "sachsen-anhalt",
        "niedersachsen",
        "deu-north"
      ]
    },
    {
      "id": "black-forest-feldberg",
      "kind": "place",
      "name": {
        "en": "Black Forest – Feldberg"
      },
      "countryCodes": [
        "DE"
      ],
      "continent": "europe",
      "center": [
        8.0,
        47.87
      ],
      "tags": [
        "forest"
      ],
      "regionHints": [
        "baden-wuerttemberg",
        "deu-south"
      ]
    },
    {
      "id": "engadin-st-moritz",
      "kind": "place",
      "name": {